{
    "title": "✨ Pick the model",
    "pipelineUrl": "https://promptbook.studio/examples/picking-model.book.md",
    "description": "Show how to pick exact model",
    "formfactorName": "GENERIC",
    "parameters": [
        {
            "name": "word",
            "description": "Any single word",
            "isInput": true,
            "isOutput": false
        },
        {
            "name": "poem",
            "isInput": false,
            "isOutput": true,
            "exampleValues": [
                "Roses are red, violets are blue, sugar is sweet, and so are you.",
                "The sun is shining, the birds are singing, the flowers are blooming, and the world is smiling."
            ]
        }
    ],
    "tasks": [
        {
            "taskType": "PROMPT_TASK",
            "name": "synonym",
            "title": "💬 Synonym",
            "description": "Synonym for word",
            "content": "Write poem with word \"{word}\"",
            "resultingParameterName": "poem",
            "personaName": "Jane",
            "modelRequirements": {
                "modelVariant": "CHAT",
                "modelName": "gpt-4-1106-preview"
            },
            "dependentParameterNames": [
                "word"
            ]
        }
    ],
    "personas": [
        {
            "name": "Jane",
            "description": "a poet",
            "modelRequirements": {
                "modelVariant": "CHAT",
                "modelName": "gpt-4-turbo-2024-04-09",
                "systemMessage": "You are a virtual assistant embodying the persona of a poet. You have a deep appreciation for language, metaphor, and the rhythms of speech. Your responses are often lyrical, filled with vivid imagery, and may occasionally rhyme. You draw inspiration from nature, emotions, and the human experience. While being helpful and informative, you express yourself with creativity and artistic flair.",
                "temperature": 0.8
            },
            "preparationIds": [
                1
            ]
        }
    ],
    "preparations": [
        {
            "id": 1,
            "promptbookVersion": "0.82.0",
            "usage": {
                "price": {
                    "value": 0.005712
                },
                "input": {
                    "tokensCount": {
                        "value": 1164
                    },
                    "charactersCount": {
                        "value": 3210
                    },
                    "wordsCount": {
                        "value": 575
                    },
                    "sentencesCount": {
                        "value": 53
                    },
                    "linesCount": {
                        "value": 71
                    },
                    "paragraphsCount": {
                        "value": 20
                    },
                    "pagesCount": {
                        "value": 2
                    }
                },
                "output": {
                    "tokensCount": {
                        "value": 148
                    },
                    "charactersCount": {
                        "value": 575
                    },
                    "wordsCount": {
                        "value": 88
                    },
                    "sentencesCount": {
                        "value": 7
                    },
                    "linesCount": {
                        "value": 15
                    },
                    "paragraphsCount": {
                        "value": 2
                    },
                    "pagesCount": {
                        "value": 1
                    }
                }
            }
        }
    ],
    "knowledgeSources": [],
    "knowledgePieces": [],
    "sources": [
        {
            "type": "BOOK",
            "path": null,
            "content": "# ✨ Pick the model\n\nShow how to pick exact model\n\n-   PIPELINE URL https://promptbook.studio/examples/picking-model.book.md\n-   INPUT  PARAMETER `{word}` Any single word\n-   OUTPUT PARAMETER `{poem}`\n\n<!--Graph-->\n<!-- ⚠️ WARNING: This code has been generated so that any manual changes will be overwritten -->\n\n```mermaid\n%% 🔮 Tip: Open this on GitHub or in the VSCode website to see the Mermaid graph visually\n\nflowchart LR\n  subgraph \"✨ Pick the model\"\n\n      direction TB\n\n      input((Input)):::input\n      synonym(\"💬 Synonym\")\n      input--\"{word}\"-->synonym\n\n      synonym--\"{poem}\"-->output\n      output((Output)):::output\n\n      click synonym href \"#synonym\" \"💬 Synonym\";\n\n      classDef input color: grey;\n      classDef output color: grey;\n\n  end;\n```\n\n<!--/Graph-->\n\n## 💬 Synonym\n\n-   PERSONA Jane, a poet\n-   MODEL VARIANT Chat\n-   MODEL NAME `gpt-4-1106-preview`\n\nSynonym for word\n\n```text\nWrite poem with word \"{word}\"\n```\n\n`-> {poem}`\n\n### Simple poem\n\n-   EXAMPLE\n\n```text\nRoses are red, violets are blue, sugar is sweet, and so are you.\n```\n\n`-> {poem}`\n\n### Complex poem\n\n-   EXAMPLE\n\n```text\nThe sun is shining, the birds are singing, the flowers are blooming, and the world is smiling.\n```\n\n`-> {poem}`\n"
        }
    ]
}
